{
  "metadata": {
    "schemaVersion": "1.0.0",
    "datasetVersion": "example-only",
    "destinationId": "it-rome",
    "generatedAt": "2026-09-20T20:00:00Z",
    "language": "en",
    "coordinateSystem": "WGS84"
  },
  "taxonomy": {
    "categories": [
      {
        "id": "gastronomy",
        "label": "Gastronomy",
        "description": "Food and drink"
      },
      {
        "id": "culture",
        "label": "Culture & Heritage",
        "description": "Built heritage, arts, history"
      },
      {
        "id": "urban",
        "label": "Urban Exploration",
        "description": "City fabric and neighborhood orientation"
      },
      {
        "id": "nature",
        "label": "Parks & Nature",
        "description": "Parks and natural destinations"
      },
      {
        "id": "experiences",
        "label": "Local Experiences",
        "description": "Craft, shopping and cultural experiences"
      },
      {
        "id": "transport",
        "label": "Transport & Wayfinding",
        "description": "Transport and mobility"
      }
    ],
    "subcategories": [
      {
        "id": "restaurant",
        "category": "gastronomy",
        "label": "Restaurant",
        "description": "restaurant POIs"
      },
      {
        "id": "trattoria",
        "category": "gastronomy",
        "label": "Trattoria",
        "description": "trattoria POIs"
      },
      {
        "id": "osteria",
        "category": "gastronomy",
        "label": "Osteria",
        "description": "osteria POIs"
      },
      {
        "id": "pizzeria",
        "category": "gastronomy",
        "label": "Pizzeria",
        "description": "pizzeria POIs"
      },
      {
        "id": "pizza_al_taglio",
        "category": "gastronomy",
        "label": "Pizza Al Taglio",
        "description": "pizza al taglio POIs"
      },
      {
        "id": "street_food",
        "category": "gastronomy",
        "label": "Street Food",
        "description": "street food POIs"
      },
      {
        "id": "sandwich_shop",
        "category": "gastronomy",
        "label": "Sandwich Shop",
        "description": "sandwich shop POIs"
      },
      {
        "id": "bakery",
        "category": "gastronomy",
        "label": "Bakery",
        "description": "bakery POIs"
      },
      {
        "id": "pastry_shop",
        "category": "gastronomy",
        "label": "Pastry Shop",
        "description": "pastry shop POIs"
      },
      {
        "id": "gelateria",
        "category": "gastronomy",
        "label": "Gelateria",
        "description": "gelateria POIs"
      },
      {
        "id": "cafe",
        "category": "gastronomy",
        "label": "Cafe",
        "description": "cafe POIs"
      },
      {
        "id": "wine_bar",
        "category": "gastronomy",
        "label": "Wine Bar",
        "description": "wine bar POIs"
      },
      {
        "id": "aperitivo",
        "category": "gastronomy",
        "label": "Aperitivo",
        "description": "aperitivo POIs"
      },
      {
        "id": "food_market",
        "category": "gastronomy",
        "label": "Food Market",
        "description": "food market POIs"
      },
      {
        "id": "specialty_food",
        "category": "gastronomy",
        "label": "Specialty Food",
        "description": "specialty food POIs"
      },
      {
        "id": "ancient_roman",
        "category": "culture",
        "label": "Ancient Roman",
        "description": "ancient roman POIs"
      },
      {
        "id": "archaeological_site",
        "category": "culture",
        "label": "Archaeological Site",
        "description": "archaeological site POIs"
      },
      {
        "id": "underground",
        "category": "culture",
        "label": "Underground",
        "description": "underground POIs"
      },
      {
        "id": "church",
        "category": "culture",
        "label": "Church",
        "description": "church POIs"
      },
      {
        "id": "basilica",
        "category": "culture",
        "label": "Basilica",
        "description": "basilica POIs"
      },
      {
        "id": "chapel",
        "category": "culture",
        "label": "Chapel",
        "description": "chapel POIs"
      },
      {
        "id": "fountain",
        "category": "culture",
        "label": "Fountain",
        "description": "fountain POIs"
      },
      {
        "id": "monument",
        "category": "culture",
        "label": "Monument",
        "description": "monument POIs"
      },
      {
        "id": "museum",
        "category": "culture",
        "label": "Museum",
        "description": "museum POIs"
      },
      {
        "id": "gallery",
        "category": "culture",
        "label": "Gallery",
        "description": "gallery POIs"
      },
      {
        "id": "palace",
        "category": "culture",
        "label": "Palace",
        "description": "palace POIs"
      },
      {
        "id": "historic_building",
        "category": "culture",
        "label": "Historic Building",
        "description": "historic building POIs"
      },
      {
        "id": "historic_library",
        "category": "culture",
        "label": "Historic Library",
        "description": "historic library POIs"
      },
      {
        "id": "theatre",
        "category": "culture",
        "label": "Theatre",
        "description": "theatre POIs"
      },
      {
        "id": "ancient_gate",
        "category": "culture",
        "label": "Ancient Gate",
        "description": "ancient gate POIs"
      },
      {
        "id": "ancient_wall",
        "category": "culture",
        "label": "Ancient Wall",
        "description": "ancient wall POIs"
      },
      {
        "id": "architecture",
        "category": "culture",
        "label": "Architecture",
        "description": "architecture POIs"
      },
      {
        "id": "religious_heritage",
        "category": "culture",
        "label": "Religious Heritage",
        "description": "religious heritage POIs"
      },
      {
        "id": "piazza",
        "category": "urban",
        "label": "Piazza",
        "description": "piazza POIs"
      },
      {
        "id": "historic_street",
        "category": "urban",
        "label": "Historic Street",
        "description": "historic street POIs"
      },
      {
        "id": "neighborhood",
        "category": "urban",
        "label": "Neighborhood",
        "description": "neighborhood POIs"
      },
      {
        "id": "courtyard",
        "category": "urban",
        "label": "Courtyard",
        "description": "courtyard POIs"
      },
      {
        "id": "passage",
        "category": "urban",
        "label": "Passage",
        "description": "passage POIs"
      },
      {
        "id": "bridge",
        "category": "urban",
        "label": "Bridge",
        "description": "bridge POIs"
      },
      {
        "id": "riverfront",
        "category": "urban",
        "label": "Riverfront",
        "description": "riverfront POIs"
      },
      {
        "id": "street_art",
        "category": "urban",
        "label": "Street Art",
        "description": "street art POIs"
      },
      {
        "id": "architectural_detail",
        "category": "urban",
        "label": "Architectural Detail",
        "description": "architectural detail POIs"
      },
      {
        "id": "viewpoint",
        "category": "urban",
        "label": "Viewpoint",
        "description": "viewpoint POIs"
      },
      {
        "id": "pedestrian_area",
        "category": "urban",
        "label": "Pedestrian Area",
        "description": "pedestrian area POIs"
      },
      {
        "id": "park",
        "category": "nature",
        "label": "Park",
        "description": "park POIs"
      },
      {
        "id": "historic_garden",
        "category": "nature",
        "label": "Historic Garden",
        "description": "historic garden POIs"
      },
      {
        "id": "botanical_garden",
        "category": "nature",
        "label": "Botanical Garden",
        "description": "botanical garden POIs"
      },
      {
        "id": "villa_grounds",
        "category": "nature",
        "label": "Villa Grounds",
        "description": "villa grounds POIs"
      },
      {
        "id": "nature_reserve",
        "category": "nature",
        "label": "Nature Reserve",
        "description": "nature reserve POIs"
      },
      {
        "id": "green_viewpoint",
        "category": "nature",
        "label": "Green Viewpoint",
        "description": "green viewpoint POIs"
      },
      {
        "id": "waterfront",
        "category": "nature",
        "label": "Waterfront",
        "description": "waterfront POIs"
      },
      {
        "id": "beach",
        "category": "nature",
        "label": "Beach",
        "description": "beach POIs"
      },
      {
        "id": "cove",
        "category": "nature",
        "label": "Cove",
        "description": "cove POIs"
      },
      {
        "id": "cave",
        "category": "nature",
        "label": "Cave",
        "description": "cave POIs"
      },
      {
        "id": "mountain_peak",
        "category": "nature",
        "label": "Mountain Peak",
        "description": "mountain peak POIs"
      },
      {
        "id": "waterfall",
        "category": "nature",
        "label": "Waterfall",
        "description": "waterfall POIs"
      },
      {
        "id": "hiking_trail",
        "category": "nature",
        "label": "Hiking Trail",
        "description": "hiking trail POIs"
      },
      {
        "id": "artisan_workshop",
        "category": "experiences",
        "label": "Artisan Workshop",
        "description": "artisan workshop POIs"
      },
      {
        "id": "historic_shop",
        "category": "experiences",
        "label": "Historic Shop",
        "description": "historic shop POIs"
      },
      {
        "id": "bookshop",